<?xml version="1.0" encoding="UTF-8"?>
<map:sheetDefinition xmlns:map="http://excel.transform.nodeservice.sri.org"
	xmlns:xsi="http://www.w3.org/2001/XMLSchema-instance"
	xsi:schemaLocation="http://excel.transform.nodeservice.sri.org nodeExcelSchema.xsd ">
	<map:sheetName>testSheet</map:sheetName>
	<map:sheetId>testExcel-1</map:sheetId>
	<map:sheetRootNodeType>testExcel</map:sheetRootNodeType>
	<map:sheetNodeType>test3SheetType</map:sheetNodeType>
	<map:sheetDescription>test3 Description</map:sheetDescription>
	<map:startRow>1</map:startRow>
	<map:endRow>12</map:endRow>

	<map:column>
		<map:columnIndex>0</map:columnIndex>
		<map:columnName>A - String</map:columnName>
	</map:column>

	<map:column>
		<map:columnIndex>1</map:columnIndex>
		<map:columnName>B - Number</map:columnName>
	</map:column>

	<map:column>
		<map:columnIndex>2</map:columnIndex>
		<map:columnName>C - Decimal</map:columnName>
	</map:column>

	<map:column>
		<map:columnIndex>3</map:columnIndex>
		<map:columnName>D - Date</map:columnName>
		<map:dateType>true</map:dateType>
	</map:column>

	<map:column>
		<map:columnIndex>4</map:columnIndex>
		<map:columnName>E - Pound</map:columnName>
	</map:column>
	
	<map:column>
		<map:columnIndex>5</map:columnIndex>
		<map:columnName>F - Formula</map:columnName>
	</map:column>
	
	<map:column>
		<map:columnIndex>6</map:columnIndex>
		<map:columnName>G - Text</map:columnName>
	</map:column>
	
	<map:column>
		<map:columnIndex>7</map:columnIndex>
		<map:columnName>H - String Formula</map:columnName>
	</map:column>
	
	<map:column>
		<map:columnIndex>8</map:columnIndex>
		<map:columnName>I - Time Type</map:columnName>
		<map:timeType>true</map:timeType>
	</map:column>

</map:sheetDefinition>
