<?xml version="1.0" encoding="UTF-8"?>
<map:sheetDefinition xmlns:map="http://excel.transform.nodeservice.sri.org" xmlns:xsi="http://www.w3.org/2001/XMLSchema-instance" xsi:schemaLocation="http://excel.transform.nodeservice.sri.org nodeExcelSchema.xsd ">
  <map:sheetName>IDS</map:sheetName>
  <map:sheetId>IDSheet-1</map:sheetId>
  <map:sheetRootNodeType>RootIDSSheetType</map:sheetRootNodeType>
  <map:sheetNodeType>IDSSheetType</map:sheetNodeType>
  <map:sheetDescription>IDS Description</map:sheetDescription>
  <map:startRow>1</map:startRow>
  <map:endRow>7</map:endRow>
  
  <map:column>
    <map:columnIndex>0</map:columnIndex>    
    <map:columnName>ID</map:columnName>   
  </map:column>
  
  <map:column>
    <map:columnIndex>1</map:columnIndex>    
    <map:columnName>Name</map:columnName>    
  </map:column>
  
  <map:column>
    <map:columnIndex>2</map:columnIndex>    
    <map:columnName>DoB</map:columnName>
    <map:dateType>true</map:dateType>
  </map:column>
</map:sheetDefinition>
